{
  "$schema": "https://json-schema.org/draft/2020-12/schema",
  "$id": "https://book.izignamx.com/schemas/evidence.schema.json",
  "type": "object",
  "additionalProperties": false,
  "required": [
    "project",
    "classification",
    "publication",
    "proofPoints",
    "sources",
    "links",
    "media"
  ],
  "properties": {
    "project": {
      "type": "object",
      "additionalProperties": false,
      "required": ["slug", "title", "owner", "summary"],
      "properties": {
        "slug": {
          "type": "string",
          "pattern": "^[a-z0-9]+(?:-[a-z0-9]+)*$"
        },
        "title": {
          "type": "string",
          "minLength": 2,
          "not": {
            "pattern": "^(Izigna|IzignaMX|Izignamx|IZIGNA)$"
          }
        },
        "owner": {
          "enum": ["IzignaMx", "Edgar Zorrilla", "Shared"]
        },
        "summary": {
          "type": "string",
          "minLength": 30
        }
      }
    },
    "classification": {
      "enum": ["real", "open-source", "internal", "concept"]
    },
    "publication": {
      "type": "object",
      "additionalProperties": false,
      "required": ["confidentiality", "publishable", "reviewedAt"],
      "properties": {
        "confidentiality": {
          "enum": ["public", "partial", "private"]
        },
        "publishable": {
          "type": "boolean"
        },
        "reviewedAt": {
          "type": "string",
          "format": "date"
        },
        "notes": {
          "type": "string"
        }
      }
    },
    "proofPoints": {
      "type": "array",
      "minItems": 1,
      "items": {
        "type": "object",
        "additionalProperties": false,
        "required": ["kind", "label", "description", "sourceIds"],
        "properties": {
          "kind": {
            "enum": [
              "verified-result",
              "system-metric",
              "expected-outcome",
              "demonstrated-capability"
            ]
          },
          "label": {
            "type": "string",
            "minLength": 2
          },
          "value": {
            "type": "string"
          },
          "description": {
            "type": "string",
            "minLength": 10
          },
          "sourceIds": {
            "type": "array",
            "minItems": 1,
            "uniqueItems": true,
            "items": {
              "type": "string"
            }
          }
        }
      }
    },
    "sources": {
      "type": "array",
      "minItems": 1,
      "items": {
        "type": "object",
        "additionalProperties": false,
        "required": ["id", "label", "type", "url"],
        "properties": {
          "id": {
            "type": "string",
            "pattern": "^[a-z0-9-]+$"
          },
          "label": {
            "type": "string"
          },
          "type": {
            "enum": [
              "live",
              "repository",
              "documentation",
              "analytics",
              "client-confirmation",
              "test-report"
            ]
          },
          "url": {
            "type": "string",
            "format": "uri"
          }
        }
      }
    },
    "links": {
      "type": "array",
      "minItems": 1,
      "items": {
        "type": "object",
        "additionalProperties": false,
        "required": ["label", "url", "public"],
        "properties": {
          "label": {
            "type": "string"
          },
          "url": {
            "type": "string",
            "format": "uri"
          },
          "public": {
            "type": "boolean"
          }
        }
      }
    },
    "media": {
      "type": "array",
      "minItems": 1,
      "contains": {
        "type": "object",
        "properties": {
          "role": {
            "const": "fallback-poster"
          }
        },
        "required": ["role"]
      },
      "items": {
        "type": "object",
        "additionalProperties": false,
        "required": ["id", "role", "path", "license"],
        "properties": {
          "id": {
            "type": "string"
          },
          "role": {
            "enum": [
              "fallback-poster",
              "screenshot",
              "video",
              "diagram",
              "logo"
            ]
          },
          "path": {
            "type": "string",
            "pattern": "^/media/projects/[a-z0-9-]+/"
          },
          "license": {
            "enum": ["owned", "client-authorized", "open-license"]
          },
          "width": {
            "type": "integer",
            "minimum": 1
          },
          "height": {
            "type": "integer",
            "minimum": 1
          },
          "alt": {
            "$ref": "#/$defs/localizedText"
          },
          "caption": {
            "$ref": "#/$defs/localizedText"
          },
          "variants": {
            "type": "object",
            "additionalProperties": false,
            "required": ["mobile", "desktop"],
            "properties": {
              "mobile": {
                "$ref": "#/$defs/mediaVariant"
              },
              "desktop": {
                "$ref": "#/$defs/mediaVariant"
              }
            }
          },
          "provenance": {
            "type": "object",
            "additionalProperties": false,
            "required": [
              "kind",
              "repository",
              "commit",
              "sourceUrl",
              "capturedAt",
              "sourceSha256",
              "rightsBasis",
              "approvedBy",
              "reviewedAt"
            ],
            "properties": {
              "kind": {
                "enum": ["deterministic-reconstruction", "direct-production-capture", "local-development-capture"]
              },
              "repository": {
                "type": "string",
                "format": "uri"
              },
              "commit": {
                "type": "string",
                "pattern": "^[a-f0-9]{40}$"
              },
              "sourceUrl": {
                "type": "string",
                "format": "uri"
              },
              "capturedAt": {
                "type": "string",
                "format": "date-time"
              },
              "sourceSha256": {
                "type": "object",
                "additionalProperties": false,
                "required": ["mobile", "desktop"],
                "properties": {
                  "mobile": {
                    "$ref": "#/$defs/sha256"
                  },
                  "desktop": {
                    "$ref": "#/$defs/sha256"
                  }
                }
              },
              "rightsBasis": {
                "type": "string",
                "minLength": 10
              },
              "approvedBy": {
                "const": "IzignaMx"
              },
              "reviewedAt": {
                "type": "string",
                "format": "date"
              }
            }
          }
        },
        "allOf": [
          {
            "if": {
              "properties": {
                "role": {
                  "const": "screenshot"
                }
              },
              "required": ["role"]
            },
            "then": {
              "required": ["width", "height", "alt", "caption", "variants", "provenance"],
              "properties": {
                "width": true,
                "height": true,
                "alt": true,
                "caption": true,
                "variants": true,
                "provenance": true
              }
            }
          }
        ]
      }
    }
  },
  "$defs": {
    "localizedText": {
      "type": "object",
      "additionalProperties": false,
      "required": ["es", "en"],
      "properties": {
        "es": {
          "type": "string",
          "minLength": 10
        },
        "en": {
          "type": "string",
          "minLength": 10
        }
      }
    },
    "mediaVariant": {
      "type": "object",
      "additionalProperties": false,
      "required": ["avif", "webp", "width", "height", "avifSha256", "webpSha256"],
      "properties": {
        "avif": {
          "type": "string",
          "pattern": "^/media/projects/[a-z0-9-]+/evidence/[a-z0-9-]+\\.avif$"
        },
        "webp": {
          "type": "string",
          "pattern": "^/media/projects/[a-z0-9-]+/evidence/[a-z0-9-]+\\.webp$"
        },
        "width": {
          "type": "integer",
          "minimum": 1
        },
        "height": {
          "type": "integer",
          "minimum": 1
        },
        "avifSha256": {
          "$ref": "#/$defs/sha256"
        },
        "webpSha256": {
          "$ref": "#/$defs/sha256"
        }
      }
    },
    "sha256": {
      "type": "string",
      "pattern": "^[a-f0-9]{64}$"
    }
  },
  "allOf": [
    {
      "if": {
        "properties": {
          "publication": {
            "type": "object",
            "properties": {
              "confidentiality": {
                "const": "private"
              }
            },
            "required": ["confidentiality"]
          }
        }
      },
      "then": {
        "properties": {
          "publication": {
            "type": "object",
            "properties": {
              "publishable": {
                "const": false
              }
            }
          }
        }
      }
    }
  ]
}
