{
  "project": {
    "slug": "hamburguesa-nomada",
    "title": "Hamburguesa Nómada",
    "owner": "IzignaMx",
    "summary": "Centro digital para un evento comunitario ciclista con resultados, reconocimientos descargables, códigos QR y catálogo basado en plantas."
  },
  "classification": "real",
  "publication": {
    "confidentiality": "public",
    "publishable": true,
    "reviewedAt": "2026-07-20",
    "notes": "El caso puede mostrar funciones públicas y el contexto comunitario autorizado."
  },
  "proofPoints": [
    {
      "kind": "demonstrated-capability",
      "label": "Reconocimientos digitales",
      "description": "La plataforma consulta resultados y genera tarjetas descargables vinculadas mediante códigos QR.",
      "sourceIds": [
        "repository",
        "live"
      ]
    },
    {
      "kind": "demonstrated-capability",
      "label": "Actualización automatizada",
      "description": "Un flujo programado detecta cambios de datos y vuelve a publicar el sitio sin intervención manual.",
      "sourceIds": [
        "repository"
      ]
    },
    {
      "kind": "demonstrated-capability",
      "label": "Experiencia PWA",
      "description": "La aplicación prioriza acceso móvil, compartir contenido y continuidad bajo condiciones de conectividad limitada.",
      "sourceIds": [
        "repository",
        "live"
      ]
    }
  ],
  "sources": [
    {
      "id": "repository",
      "label": "Repositorio Hamburguesa Nómada",
      "type": "repository",
      "url": "https://github.com/IzignaMx/hamburguesa-nomada"
    },
    {
      "id": "live",
      "label": "Sitio Hamburguesa Nómada",
      "type": "live",
      "url": "https://nomada.izignamx.com/"
    }
  ],
  "links": [
    {
      "label": "Sitio público",
      "url": "https://nomada.izignamx.com/",
      "public": true
    },
    {
      "label": "Código fuente",
      "url": "https://github.com/IzignaMx/hamburguesa-nomada",
      "public": true
    }
  ],
  "media": [
    {
      "id": "fallback-poster",
      "role": "fallback-poster",
      "path": "/media/projects/hamburguesa-nomada/poster.avif",
      "license": "owned"
    },
    {
      "id": "home-production",
      "role": "screenshot",
      "path": "/media/projects/hamburguesa-nomada/evidence/home-desktop.avif",
      "license": "client-authorized",
      "width": 1440,
      "height": 900,
      "alt": {
        "es": "Portada de producción de Hamburguesa Nómada con su cartel ciclista de aniversario en tonos rosa y rojo.",
        "en": "Production homepage of Hamburguesa Nómada with its pink and red anniversary cycling poster."
      },
      "caption": {
        "es": "Captura directa y revisada de la portada pública de producción; el repositorio de referencia corresponde al commit 0546706.",
        "en": "Reviewed direct capture of the public production homepage; the reference repository points to commit 0546706."
      },
      "variants": {
        "mobile": {
          "avif": "/media/projects/hamburguesa-nomada/evidence/home-mobile.avif",
          "webp": "/media/projects/hamburguesa-nomada/evidence/home-mobile.webp",
          "width": 390,
          "height": 844,
          "avifSha256": "3c5d3d313284d7dc62c5b8415a1c028657b7fb59a832e10a3a2bdf8065c13dbf",
          "webpSha256": "572bf217665f1bb32f2cff1d80f88b493b3f5bde3b36e13301cbed59fd1d58c6"
        },
        "desktop": {
          "avif": "/media/projects/hamburguesa-nomada/evidence/home-desktop.avif",
          "webp": "/media/projects/hamburguesa-nomada/evidence/home-desktop.webp",
          "width": 1440,
          "height": 900,
          "avifSha256": "35c73addac8c7c0da4ffe63646daaf5d213ddbde45a93514037be4478af92d34",
          "webpSha256": "6379e43c27611f6e448b2f88cb740a46385393e65381b606f7d96e7969cd57d7"
        }
      },
      "provenance": {
        "kind": "direct-production-capture",
        "repository": "https://github.com/IzignaMx/hamburguesa-nomada",
        "commit": "05467064095c9bb31e7ccc47bb8184f380531706",
        "sourceUrl": "https://nomada.izignamx.com/",
        "capturedAt": "2026-08-02T01:30:32.445Z",
        "sourceSha256": {
          "mobile": "6436a8e5289aaa71a7b4329f416d3b779ef8793d253c20abeaf4d8fe17ad2739",
          "desktop": "5bae92417d6061f283da99d3fede418ae1f892c194c54be33bcc29dd03c653e2"
        },
        "rightsBasis": "Publication of this direct production capture is authorized by IzignaMx for portfolio evidence; the reference source code is available under GPL-2.0.",
        "approvedBy": "IzignaMx",
        "reviewedAt": "2026-08-02"
      }
    }
  ]
}
