{
  "project": {
    "slug": "vald",
    "title": "VALD",
    "owner": "IzignaMx",
    "summary": "Experiencia digital de ultraciclismo que organiza ruta, elevación, cronología, resultados, galería y patrocinadores en una entrega estática."
  },
  "classification": "real",
  "publication": {
    "confidentiality": "public",
    "publishable": true,
    "reviewedAt": "2026-07-20",
    "notes": "El sitio y el repositorio son públicos; las afirmaciones se limitan a comportamiento observable."
  },
  "proofPoints": [
    {
      "kind": "demonstrated-capability",
      "label": "Narrativa de ruta",
      "description": "La experiencia integra cronología, elevación, puntos de control y resultados en una estructura editorial modular.",
      "sourceIds": [
        "repository",
        "live"
      ]
    },
    {
      "kind": "demonstrated-capability",
      "label": "Arquitectura estática",
      "description": "Astro, estilos modulares y generación estática reducen dependencias de ejecución y favorecen despliegues simples.",
      "sourceIds": [
        "repository"
      ]
    },
    {
      "kind": "demonstrated-capability",
      "label": "Continuidad móvil",
      "description": "La interfaz se diseñó con enfoque mobile-first, soporte PWA y contenido utilizable sin animaciones avanzadas.",
      "sourceIds": [
        "repository",
        "live"
      ]
    }
  ],
  "sources": [
    {
      "id": "repository",
      "label": "Repositorio VALD",
      "type": "repository",
      "url": "https://github.com/IzignaMx/vald-landing"
    },
    {
      "id": "live",
      "label": "Sitio VALD",
      "type": "live",
      "url": "https://vald.izignamx.com/"
    }
  ],
  "links": [
    {
      "label": "Sitio público",
      "url": "https://vald.izignamx.com/",
      "public": true
    },
    {
      "label": "Código fuente",
      "url": "https://github.com/IzignaMx/vald-landing",
      "public": true
    }
  ],
  "media": [
    {
      "id": "fallback-poster",
      "role": "fallback-poster",
      "path": "/media/projects/vald/poster.avif",
      "license": "owned"
    },
    {
      "id": "home-production",
      "role": "screenshot",
      "path": "/media/projects/vald/evidence/home-desktop.avif",
      "license": "owned",
      "width": 1440,
      "height": 900,
      "alt": {
        "es": "Portada de producción de VALD con identidad de ultraciclismo 2026, ruta y llamada principal del evento.",
        "en": "Production homepage of VALD with its 2026 ultracycling identity, route, and primary event callout."
      },
      "caption": {
        "es": "Captura directa y revisada del sitio público de producción; el repositorio propiedad de IzignaMx corresponde al commit 620dd20.",
        "en": "Reviewed direct capture of the public production site; the IzignaMx-owned repository points to commit 620dd20."
      },
      "variants": {
        "mobile": {
          "avif": "/media/projects/vald/evidence/home-mobile.avif",
          "webp": "/media/projects/vald/evidence/home-mobile.webp",
          "width": 390,
          "height": 844,
          "avifSha256": "d4f3dde9e4e6cf0db26aae0c3b000e4841a5c57ab246bba95a0baa290216b69b",
          "webpSha256": "c3af5fb68bfbd5155ea0761c22dc685a1d7c3807b73b4b7ed4e3b4f9c00cec60"
        },
        "desktop": {
          "avif": "/media/projects/vald/evidence/home-desktop.avif",
          "webp": "/media/projects/vald/evidence/home-desktop.webp",
          "width": 1440,
          "height": 900,
          "avifSha256": "2c2633b3353000544fcae9e65ae6bbc35b48c65639f2c7909c369fcdf522e983",
          "webpSha256": "88c1008e5b685fd0ab05c9ee6f3c122200cdfd8fd6399c9673d5e355a952059b"
        }
      },
      "provenance": {
        "kind": "direct-production-capture",
        "repository": "https://github.com/IzignaMx/vald-landing",
        "commit": "620dd20e0cb1c3710fab513b828265f072222a87",
        "sourceUrl": "https://vald.izignamx.com/",
        "capturedAt": "2026-08-02T01:30:33.877Z",
        "sourceSha256": {
          "mobile": "e68e15b93ce5e635341138b32b7b2c694a60ca23f7a5fed15ef8c0072756ab39",
          "desktop": "d725c1314a9f5a2fc8cc571182da6a304e044fde6ffe93e1d044b9fbf5816403"
        },
        "rightsBasis": "IzignaMx-owned repository with all rights reserved; approved by IzignaMx for portfolio evidence.",
        "approvedBy": "IzignaMx",
        "reviewedAt": "2026-08-02"
      }
    }
  ]
}
