{
  "project": {
    "slug": "developer-tools",
    "title": "Developer Tools Collection",
    "owner": "Edgar Zorrilla",
    "summary": "Colección abierta de herramientas para commits asistidos por IA, descarga autenticada de contenido y edición visual dentro de BigCommerce."
  },
  "classification": "open-source",
  "publication": {
    "confidentiality": "public",
    "publishable": true,
    "reviewedAt": "2026-07-20",
    "notes": "Cada herramienta conserva su licencia, límites de uso, privacidad y documentación pública."
  },
  "proofPoints": [
    {
      "kind": "demonstrated-capability",
      "label": "Smart Git Commit",
      "description": "CLI que analiza cambios, propone agrupaciones atómicas y genera mensajes compatibles con Conventional Commits mediante modelos locales.",
      "sourceIds": [
        "smart-git",
        "smart-git-pypi"
      ]
    },
    {
      "kind": "demonstrated-capability",
      "label": "Instagram Downloader Skill",
      "description": "Skill y CLI que coordinan sesión autenticada, automatización de navegador y rutas de recuperación sin solicitar contraseñas.",
      "sourceIds": [
        "instagram-skill"
      ]
    },
    {
      "kind": "demonstrated-capability",
      "label": "BigCommerce WYSIWYG Extension",
      "description": "Extensión que incorpora edición visual local en Page Builder respetando restricciones de seguridad del navegador.",
      "sourceIds": [
        "bigcommerce-extension",
        "bigcommerce-demo"
      ]
    }
  ],
  "sources": [
    {
      "id": "smart-git",
      "label": "Repositorio Smart Git Commit",
      "type": "repository",
      "url": "https://github.com/CripterHack/smart-git-commit"
    },
    {
      "id": "smart-git-pypi",
      "label": "Paquete Smart Git Commit en PyPI",
      "type": "documentation",
      "url": "https://pypi.org/project/smart-git-commit/"
    },
    {
      "id": "instagram-skill",
      "label": "Repositorio Instagram Downloader Skill",
      "type": "repository",
      "url": "https://github.com/CripterHack/ig-downloader-skill"
    },
    {
      "id": "bigcommerce-extension",
      "label": "Repositorio BigCommerce WYSIWYG Extension",
      "type": "repository",
      "url": "https://github.com/CripterHack/bigcommerce-wysiwyg-extension"
    },
    {
      "id": "bigcommerce-demo",
      "label": "Presentación BigCommerce WYSIWYG Extension",
      "type": "live",
      "url": "https://cripterhack.github.io/bigcommerce-wysiwyg-extension/"
    },
    {
      "id": "live",
      "label": "Catálogo de aplicaciones IzignaMx",
      "type": "live",
      "url": "https://apps.izignamx.com/"
    }
  ],
  "links": [
    {
      "label": "Catálogo de aplicaciones",
      "url": "https://apps.izignamx.com/",
      "public": true
    },
    {
      "label": "Smart Git Commit",
      "url": "https://github.com/CripterHack/smart-git-commit",
      "public": true
    },
    {
      "label": "Smart Git Commit en PyPI",
      "url": "https://pypi.org/project/smart-git-commit/",
      "public": true
    },
    {
      "label": "Instagram Downloader Skill",
      "url": "https://github.com/CripterHack/ig-downloader-skill",
      "public": true
    },
    {
      "label": "BigCommerce WYSIWYG Extension",
      "url": "https://github.com/CripterHack/bigcommerce-wysiwyg-extension",
      "public": true
    },
    {
      "label": "Demostración BigCommerce WYSIWYG",
      "url": "https://cripterhack.github.io/bigcommerce-wysiwyg-extension/",
      "public": true
    }
  ],
  "media": [
    {
      "id": "fallback-poster",
      "role": "fallback-poster",
      "path": "/media/projects/developer-tools/poster.avif",
      "license": "owned"
    },
    {
      "id": "bigcommerce-demo-production",
      "role": "screenshot",
      "path": "/media/projects/developer-tools/evidence/home-desktop.avif",
      "license": "client-authorized",
      "width": 1440,
      "height": 900,
      "alt": {
        "es": "Demostración pública de producción de la extensión WYSIWYG para BigCommerce con editor visual y documentación.",
        "en": "Public production demo of the BigCommerce WYSIWYG extension with visual editing and documentation."
      },
      "caption": {
        "es": "Captura directa y revisada de la demostración pública; representa una herramienta de la colección mantenida en el commit fcabcea.",
        "en": "Reviewed direct capture of the public demo; it represents one tool in the collection maintained at commit fcabcea."
      },
      "variants": {
        "mobile": {
          "avif": "/media/projects/developer-tools/evidence/home-mobile.avif",
          "webp": "/media/projects/developer-tools/evidence/home-mobile.webp",
          "width": 390,
          "height": 844,
          "avifSha256": "2655d3623c3e7c6f85c0c27fff88d332e559679bd6e2bcbe5968a27e19dc8507",
          "webpSha256": "3a9e3cbe416522157b1b9eaf7fd7898daeaf7350407159ff2a1d255194adb877"
        },
        "desktop": {
          "avif": "/media/projects/developer-tools/evidence/home-desktop.avif",
          "webp": "/media/projects/developer-tools/evidence/home-desktop.webp",
          "width": 1440,
          "height": 900,
          "avifSha256": "d36d2466165213a8d3b48b2486a669505d3a91bd5f036124bf79bda64b545a54",
          "webpSha256": "e83755ea5ce31b45661e2335285a625c3f2b811ac18a0c4d9e7731bb05a0a15e"
        }
      },
      "provenance": {
        "kind": "direct-production-capture",
        "repository": "https://github.com/CripterHack/bigcommerce-wysiwyg-extension",
        "commit": "fcabcea67d2fecc3f14f648eb2d833b9ab35452e",
        "sourceUrl": "https://cripterhack.github.io/bigcommerce-wysiwyg-extension/",
        "capturedAt": "2026-08-02T01:30:39.061Z",
        "sourceSha256": {
          "mobile": "30ee37b4489e9f7c920fb04afd3e906ed91f5aa53c9f7e58b440990e284b8207",
          "desktop": "4c16373d62688ac233785c67a578bd1f0284618cc7cc64370634d235000b60d4"
        },
        "rightsBasis": "Publication of this direct production capture is authorized by IzignaMx for portfolio evidence; the reference implementation is maintained publicly by CripterHack.",
        "approvedBy": "IzignaMx",
        "reviewedAt": "2026-08-02"
      }
    }
  ]
}
